<?xml version="1.0" encoding="UTF-8" standalone="yes"?>
<memory 
    xmlns="http://mem4csd.telecom-paris.fr/OtawaMemory" 
    xmlns:xsi="http://www.w3.org/2001/XMLSchema-instance" 
    xsi:schemaLocation="http://mem4csd.telecom-paris.fr/OtawaMemory OtawaMemory.xsd">
	<banks>
		<bank>
			<name>RAM</name>
			<address><offset>0x00000000</offset></address>
			<size>0x1fffffff</size>
			<type>DRAM</type>
			<latency>25</latency>
			<writable>true</writable>
			<cachable>true</cachable>
		</bank>
	</banks>
</memory>
